A2: ICS-6A Winter 2002, Discrete Mathematics for Computer Science
A4: [ course reference | schedule | homework | handouts | grades | exams ]

A1: Grades

A1: last five ID# | B1: HW1(100) | C1: HW2(100) | D1: HW3(100) | E1: Hw4(100) | F1: HW5(100) | G1: HW6(100) | H1: HW7(100) | I1: Quiz1(100) | J1: Quiz2(100) | K1: Quiz3(100) | L1: Quiz4(100) | M1: Quiz5(100) | N1: Quiz6(80) | O1: Midterm(100) | P1: Final(135)
A2: 00960 | C2: 82 | D2: 70 | F2: 88 | I2: 90 | J2: 81 | K2: 47 | L2: 73 | M2: 63 | N2: 30 | O2: 77 | P2: 58
A3: 01234 | B3: 77 | C3: 90 | D3: 70 | G3: 90 | H3: 87 | I3: 92 | J3: 95 | K3: 70 | L3: 80 | M3: 88 | N3: 75 | O3: 83 | P3: 92
A4: 02297 | B4: 67 | C4: 76 | D4: 60 | E4: 73 | F4: 30 | G4: 89 | H4: 91 | I4: 84 | J4: 55 | K4: 44 | L4: 15 | M4: 64 | O4: 65 | P4: 18
A5: 02905 | B5: 72 | C5: 98 | D5: 66 | F5: 75 | I5: 102 | J5: 92 | K5: 100 | L5: 65 | M5: 96 | N5: 35 | O5: 91 | P5: 129
A6: 04908 | B6: 84 | C6: 100 | D6: 74 | E6: 95 | F6: 63 | G6: 97 | H6: 94 | I6: 102 | J6: 100 | K6: 50 | L6: 95 | M6: 96 | N6: 80 | O6: 94 | P6: 128
A7: 06076 | B7: 67 | C7: 70 | D7: 59 | E7: 90 | F7: 40 | G7: 90 | H7: 83 | I7: 97 | J7: 81 | K7: 90 | L7: 99 | M7: 102 | N7: 50 | O7: 92 | P7: 76
A8: 06532 | B8: 88 | C8: 100 | D8: 92 | E8: 100 | F8: 99 | G8: 99 | H8: 95 | I8: 99 | J8: 110 | K8: 88 | L8: 103 | M8: 110 | O8: 100 | P8: 142
A9: 06657 | B9: 79 | C9: 94 | D9: 62 | E9: 85 | F9: 81 | G9: 87 | H9: 87 | I9: 93 | J9: 65 | K9: 78 | L9: 45 | M9: 68 | N9: 80 | O9: 69 | P9: 110
A10: 07732 | B10: 48 | C10: 92 | D10: 64 | E10: 85 | G10: 92 | H10: 94 | I10: 100 | J10: 73 | K10: 35 | L10: 25 | M10: 95 | N10: 40 | O10: 78 | P10: 56
A11: 08634 | B11: 52 | C11: 96 | D11: 74 | E11: 88 | F11: 63 | G11: 96 | H11: 96 | I11: 110 | K11: 40 | L11: 50 | M11: 80 | N11: 80 | O11: 84 | P11: 69
A12: 09076 | B12: 76 | C12: 92 | D12: 70 | E12: 93 | F12: 92 | G12: 97 | H12: 68 | I12: 82 | J12: 88 | K12: 85 | L12: 90 | M12: 70 | N12: 50 | O12: 87 | P12: 51
A13: 11628 | B13: 68 | C13: 80 | D13: 97 | E13: 98 | F13: 86 | G13: 96 | H13: 90 | I13: 92 | J13: 100 | K13: 85 | L13: 105 | M13: 100 | N13: 60 | O13: 95 | P13: 121
A14: 12031 | B14: 50 | C14: 82 | D14: 64 | E14: 88 | F14: ï¿½ | G14: 95 | I14: 77 | J14: 80 | K14: 55 | L14: 100 | M14: 66 | N14: 35 | O14: 66 | P14: 102
A15: 12552 | B15: 68 | C15: 84 | D15: 52 | E15: 88 | H15: 60 | I15: 85 | J15: 93 | K15: 37 | O15: 76 | P15: 36
A16: 13191 | B16: 30 | C16: 80 | D16: 32 | G16: 84 | I16: 36 | J16: 59 | K16: 35 | L16: 44 | M16: 51 | O16: 65
A17: 14808 | B17: 81 | C17: 86 | D17: 64 | F17: 71 | G17: 91 | H17: 88 | I17: 105 | J17: 89 | K17: 60 | L17: 88 | M17: 90 | N17: 60 | O17: 64 | P17: 83
A18: 14892 | B18: 69 | C18: 84 | D18: 82 | E18: 82 | F18: 61 | I18: 100 | J18: 75 | K18: 75 | L18: 100 | O18: 74 | P18: 69
A19: 16588 | B19: 62 | C19: 88 | D19: 70 | F19: 62 | H19: 74 | J19: 78 | K19: 85 | L19: 105 | M19: 98 | N19: 70 | O19: 93 | P19: 86
A20: 19749 | B20: 51 | C20: 64 | D20: 78 | I20: 100 | J20: 35 | K20: 40 | L20: 75 | O20: 62
A21: 19798 | B21: 12 | C21: 86 | D21: 72 | E21: 75 | G21: 90 | H21: 67 | I21: 71 | J21: 52 | K21: 50 | L21: 25 | M21: 63 | N21: 15 | O21: 65 | P21: 49
A22: 21895 | B22: 54 | C22: 82 | D22: 80 | E22: 88 | I22: 86 | J22: 100 | K22: 70 | L22: 65 | M22: 77 | N22: 50 | O22: 76 | P22: 74
A23: 22455 | B23: 34 | C23: 96 | D23: 84 | E23: 90 | G23: 89 | H23: 95 | I23: 100 | J23: 93 | K23: 65 | L23: 75 | M23: 78 | O23: 87 | P23: 79
A24: 25210 | B24: 6 | C24: 82 | D24: 30 | F24: 60 | I24: 95 | J24: 110 | K24: 54 | L24: 94 | M24: 73 | N24: 35 | O24: 78 | P24: 57
A25: 27294 | B25: 74 | C25: 92 | D25: 96 | E25: 100 | F25: 83 | G25: 100 | H25: 95 | I25: 102 | J25: 110 | K25: 100 | L25: 95 | M25: 109 | N25: 70 | O25: 100 | P25: 122
A26: 27671 | B26: 48 | C26: 76 | D26: 52 | F26: 30 | I26: 89 | J26: 110 | K26: 44 | L26: 10 | M26: 86 | O26: 54 | P26: 50
A27: 28509 | B27: 48 | C27: 96 | D27: 96 | E27: 95 | F27: 94 | G27: 97 | H27: 94 | I27: 98 | J27: 104 | K27: 90 | L27: 85 | M27: 81 | N27: 64 | O27: 93 | P27: 119
A28: 33917 | B28: 78 | C28: 100 | D28: 100 | E28: 94 | F28: 100 | G28: 96 | H28: 99 | I28: 99 | J28: 85 | K28: 105 | L28: 85 | M28: 77 | N28: 70 | O28: 91 | P28: 123
A29: 34401 | B29: 88 | C29: 88 | D29: 90 | E29: 95 | F29: 97 | G29: 100 | H29: 95 | I29: 86 | J29: 73 | K29: 70 | L29: 85 | M29: 104 | N29: 75 | O29: 91 | P29: 111
A30: 36371 | B30: 72 | C30: 96 | D30: 80 | E30: 95 | F30: 79 | G30: 98 | H30: 74 | I30: 100 | J30: 66 | L30: 50 | M30: 72 | N30: 40 | O30: 66 | P30: 67
A31: 39199 | C31: 100 | I31: 75 | J31: 55 | K31: 54 | N31: 50 | O31: 53 | P31: 53
A32: 41307 | G32: 80 | I32: 102 | K32: 44 | M32: 58 | O32: 77 | P32: 80
A33: 41577 | B33: 84 | C33: 94 | D33: 92 | E33: 95 | F33: 94 | G33: 98 | H33: 89 | I33: 105 | J33: 79 | K33: 80 | L33: 95 | M33: 60 | N33: 65 | O33: 92 | P33: 72
A34: 41971 | B34: 78 | C34: 96 | D34: 88 | E34: 88 | F34: 100 | G34: 99 | H34: 86 | I34: 98 | J34: 85 | K34: 105 | L34: 79 | M34: 95 | N34: 70 | O34: 76 | P34: 70
A35: 42162 | B35: 73 | D35: 88 | F35: 95 | G35: 81 | I35: 91 | J35: 52 | K35: 45 | L35: 0 | M35: 80 | N35: 70 | O35: 68 | P35: 64
A36: 42614 | B36: 86 | C36: 98 | D36: 98 | E36: 83 | F36: 82 | G36: 96 | H36: 90 | I36: 60 | J36: 103 | K36: 100 | L36: 79 | M36: 92 | N36: 50 | O36: 92 | P36: 83
A37: 42695 | B37: 84 | C37: 96 | D37: 96 | E37: 95 | F37: 67 | G37: 98 | I37: 90 | J37: 110 | K37: 80 | L37: 100 | M37: 106 | N37: 70 | O37: 92 | P37: 132
A38: 45733 | C38: 94 | D38: 50 | F38: 41 | I38: 100 | J38: 110 | M38: 68 | N38: 60 | O38: 62
A39: 46702 | B39: 94 | C39: 94 | D39: 86 | E39: 88 | F39: 92 | J39: 55 | K39: 78 | L39: 100 | M39: 82 | N39: 80 | O39: 80 | P39: 117
A40: 47955 | B40: 97 | C40: 90 | D40: 82 | E40: 94 | F40: 87 | J40: 57 | K40: 63 | M40: 68 | N40: 65 | O40: 94 | P40: 97
A41: 48358 | B41: 64 | C41: 80 | D41: 80 | E41: 94 | F41: 97 | I41: 73 | J41: 59 | K41: 27 | L41: 90 | N41: 45 | O41: 93 | P41: 73
A42: 49207 | B42: 52 | C42: 92 | D42: 50 | G42: 84 | H42: 82 | I42: 95 | J42: 66 | K42: 44 | L42: 45 | M42: 57 | N42: 30 | O42: 81 | P42: 28
A43: 49211 | C43: 66 | D43: 76 | F43: 50 | G43: 76 | H43: 70 | I43: 66 | J43: 93 | K43: 56 | L43: 90 | M43: 53 | N43: 55 | O43: 84 | P43: 74
A44: 49289 | B44: 98 | C44: 100 | D44: 100 | E44: 100 | H44: 94 | I44: 92 | J44: 105 | K44: 80 | N44: 30 | O44: 86 | P44: 42
A45: 52376 | I45: 107
A46: 54723 | B46: 83 | C46: 94 | D46: 72 | E46: 90 | F46: 96 | G46: 98 | H46: 92 | I46: 78 | J46: 95 | K46: 80 | L46: 45 | M46: 92 | N46: 60 | O46: 83 | P46: 43
A47: 58026 | B47: 67 | C47: 92 | H47: 93 | J47: 75 | K47: 95 | N47: 50 | O47: 76 | P47: 92
A48: 59884 | C48: 90 | D48: 74 | F48: 62 | I48: 87 | J48: 110 | K48: 79 | L48: 80 | M48: 74 | N48: 40 | O48: 78 | P48: 97
A49: 62181 | B49: 50 | C49: 88 | D49: 80 | E49: 78 | F49: 69 | G49: 95 | H49: 93 | I49: 58 | J49: 97 | K49: 55 | L49: 65 | M49: 63 | N49: 45 | O49: 57 | P49: 43
A50: 64099 | B50: 50 | C50: 90 | D50: 92 | F50: 81 | G50: 98 | H50: 86 | I50: 90 | J50: 68 | K50: 45 | L50: 68 | M50: 95 | N50: 50 | O50: 77
A51: 65272 | I51: 95 | L51: 75 | M51: 45 | N51: 30 | O51: 70 | P51: 55
A52: 65992 | B52: 67 | C52: 94 | D52: 88 | G52: 85 | H52: 79 | I52: 102 | J52: 104 | K52: 80 | L52: 95 | M52: 85 | O52: 81 | P52: 102
A53: 66851 | B53: 77 | C53: 96 | D53: 88 | E53: 92 | F53: 91 | G53: 95 | H53: 93 | I53: 99 | J53: 80 | K53: 89 | L53: 100 | M53: 87 | N53: 55 | O53: 85 | P53: 117
A54: 69149 | B54: 32 | C54: 90 | D54: 72 | J54: 32 | K54: 15
A55: 69335 | B55: 78 | C55: 90 | D55: 82 | E55: 90 | F55: 81 | G55: 97 | H55: 94 | I55: 94 | J55: 70 | K55: 90 | L55: 85 | M55: 101 | N55: 70 | O55: 97 | P55: 113
A56: 69354 | B56: 91 | C56: 96 | D56: 88 | E56: 97 | F56: 100 | G56: 99 | H56: 92 | I56: 105 | J56: 110 | K56: 75 | L56: 78 | M56: 110 | N56: 70 | O56: 80 | P56: 98
A57: 69679 | B57: 72 | C57: 78 | D57: 70 | E57: 92 | F57: 75 | G57: 98 | H57: 91 | I57: 96 | J57: 94 | K57: 37 | L57: 40 | M57: 91 | N57: 45 | O57: 65 | P57: 33
A58: 71467 | B58: 68 | C58: 94 | D58: 68 | E58: 90 | F58: 57 | G58: 98 | I58: 105 | J58: 110 | K58: 84 | L58: 85 | M58: 99 | O58: 78 | P58: 82
A59: 75081 | B59: 58 | C59: 90 | D59: 64 | E59: 85 | F59: 88 | G59: 94 | H59: 84 | I59: 100 | J59: 100 | K59: 63 | L59: 70 | M59: 72 | O59: 70
A60: 76912 | B60: 72 | C60: 90 | D60: 76 | E60: 91 | F60: 90 | G60: 98 | H60: 90 | I60: 102 | J60: 89 | K60: 53 | L60: 79 | M60: 90 | N60: 64 | O60: 79 | P60: 106
A61: 77352 | C61: 90 | E61: 97 | F61: 82 | G61: 87 | H61: 94 | J61: 100 | K61: 38 | L61: 79 | M61: 93 | N61: 70 | O61: 77 | P61: 119
A62: 79162 | B62: 79 | C62: 84 | D62: 92 | G62: 99 | H62: 95 | I62: 64 | J62: ï¿½ | K62: 45 | L62: 70 | M62: 93 | N62: 60 | O62: 80 | P62: 97
A63: 79385 | B63: 75 | C63: 80 | D63: 84 | E63: 92 | F63: 83 | G63: 85 | H63: 83 | I63: 106 | J63: 100 | K63: 52 | L63: 105 | M63: 56 | N63: 55 | O63: 69 | P63: 64
A64: 79553 | B64: 64 | C64: 90 | D64: 84 | E64: 85 | H64: 88 | I64: 108 | J64: 110 | L64: 105 | N64: 35 | O64: 87 | P64: 82
A65: 79844 | B65: 85 | C65: 90 | D65: 92 | E65: 92 | F65: 88 | G65: 89 | H65: 90 | I65: 110 | J65: 95 | K65: 85 | L65: 80 | M65: 77 | N65: 70 | O65: 83 | P65: 104
A66: 81844 | B66: 83 | C66: 94 | D66: 90 | E66: 95 | F66: 91 | G66: 91 | I66: 73 | J66: 48 | K66: 50 | L66: 20 | M66: 55 | N66: 25 | O66: 55 | P66: 25
A67: 83418 | B67: 69 | C67: 98 | D67: 86 | E67: 98 | F67: 96 | G67: 98 | H67: 95 | I67: 110 | J67: 104 | K67: 75 | L67: 99 | M67: 102 | N67: 70 | O67: 99 | P67: 106
A68: 83523 | B68: 82 | C68: 96 | D68: 88 | E68: 92 | F68: 90 | G68: 95 | H68: 96 | I68: 99 | J68: 110 | K68: 79 | L68: 80 | M68: 96 | N68: 35 | O68: 96 | P68: 120
A69: 85012 | B69: 62 | C69: 86 | D69: 72 | E69: 92 | F69: 90 | G69: 86 | H69: 94 | I69: 92 | J69: 90 | K69: 39 | L69: 85 | M69: 67 | N69: 70 | O69: 65 | P69: 100
A70: 85401 | E70: 92 | I70: 98 | J70: 100 | M70: 73 | O70: 76 | P70: 91
A71: 85581 | B71: 34 | C71: 80 | D71: 56 | E71: 80 | F71: 30 | G71: 87 | I71: 98 | J71: 110 | K71: 54 | L71: 60 | M71: 64 | N71: 35 | O71: 72 | P71: 70
A72: 86090 | B72: 44 | C72: 90 | D72: 79 | E72: 85 | F72: 54 | G72: 91 | H72: 77 | I72: 74 | J72: 35 | K72: 70 | L72: 65 | M72: 78 | N72: 50 | O72: 88 | P72: 106
A73: 87077 | C73: 88 | D73: 74 | E73: 80 | F73: 68 | G73: 95 | J73: 94 | K73: 40 | L73: 45 | M73: 83 | N73: 60 | O73: 75 | P73: 88
A74: 88215 | B74: 84 | C74: 84 | D74: 80 | E74: 95 | F74: 100 | G74: 92 | I74: 98 | J74: 80 | K74: 75 | L74: 110 | M74: 88 | N74: 70 | O74: 89 | P74: 103
A75: 88577 | B75: 64 | C75: 94 | D75: 84 | E75: 95 | F75: 81 | G75: 98 | I75: 105 | J75: 95 | K75: 55 | L75: 90 | M75: 84 | N75: 40 | O75: 81 | P75: 88
A76: 89260 | B76: 30 | C76: 92 | D76: 76 | E76: 97 | F76: 75 | G76: 88 | H76: 80 | I76: 108 | J76: 90 | K76: 90 | L76: 90 | M76: 94 | N76: 80 | O76: 90 | P76: 111
A77: 91907 | B77: 74 | C77: 82 | F77: 97 | I77: 87 | J77: 75 | K77: 38 | L77: 45 | M77: 55 | N77: 30 | O77: 68 | P77: 40
A78: 92672 | B78: 77 | C78: 90 | D78: 84 | E78: 92 | F78: 77 | G78: 85 | H78: 93 | I78: 97 | J78: 86 | K78: 65 | L78: 75 | M78: 109 | N78: 50 | O78: 96 | P78: 145
A79: 92694 | B79: 80 | C79: 82 | D79: 70 | E79: 88 | F79: 87 | G79: 89 | H79: 66 | I79: 90 | J79: 54 | K79: 85 | L79: 85 | M79: 77 | N79: 35 | O79: 72 | P79: 67
A80: 94308 | B80: 58 | C80: 86 | D80: 64 | E80: 95 | F80: 70 | G80: 91 | H80: 86 | I80: 100 | J80: 60 | K80: 67 | L80: 90 | M80: 110 | N80: 60 | O80: 96 | P80: 122
A81: 94421 | B81: 74 | C81: 90 | D81: 92 | F81: 100 | G81: 90 | H81: 96 | I81: 105 | J81: 43 | K81: 44 | L81: 70 | M81: 71 | N81: 50 | O81: 69 | P81: 66
A82: 96472 | B82: 79 | C82: 90 | D82: 100 | E82: 95 | F82: 60 | G82: 96 | H82: 92 | I82: 93 | J82: 110 | K82: 74 | L82: 80 | M82: 65 | N82: 65 | O82: 81 | P82: 73
A83: 96886 | B83: 60 | C83: 86 | D83: 25 | F83: 55 | G83: 84 | H83: 91 | I83: 95 | J83: 70 | K83: 50 | L83: 34 | M83: 51 | N83: 55 | O83: 82 | P83: 66
A84: 96947 | B84: 87 | C84: 96 | D84: 86 | E84: 97 | F84: 100 | G84: 98 | H84: 92 | I84: 96 | J84: 98 | K84: 65 | L84: 55 | M84: 87 | N84: 70 | O84: 81 | P84: 85
A85: 98396 | C85: 98 | D85: 98 | E85: 95 | F85: 74 | H85: 88 | I85: 102 | J85: 110 | K85: 95 | L85: 98 | M85: 100 | O85: 100 | P85: 142
A86: 98806 | B86: 84 | C86: 94 | D86: 92 | E86: 85 | F86: 77 | H86: 92 | I86: 80 | J86: 94 | K86: 55 | L86: 50 | M86: 74 | N86: 55 | O86: 86 | P86: 59
A87: 99199 | B87: 100 | C87: 96 | D87: 100 | E87: 95 | G87: 98 | I87: 94 | J87: 110 | K87: 72 | L87: 95 | N87: 55 | O87: 69 | P87: 103
A88: 99818 | B88: 77 | I88: 105 | L88: 80 | M88: 53 | N88: 50 | O88: 96 | P88: 81
A91: Max | B91: =MAX(B2:B88) -> 100 | C91: =MAX(C2:C88) -> 100 | D91: =MAX(D2:D88) -> 100 | E91: =MAX(E2:E88) -> 100 | F91: =MAX(F2:F88) -> 100 | G91: =MAX(G2:G88) -> 100 | H91: =MAX(H2:H88) -> 99 | I91: =MAX(I2:I88) -> 110 | J91: =MAX(J2:J88) -> 110 | K91: =MAX(K2:K88) -> 105 | L91: =MAX(L2:L88) -> 110 | M91: =MAX(M2:M88) -> 110 | N91: =MAX(N2:N88) -> 80 | O91: =MAX(O2:O88) -> 100 | P91: =MAX(P2:P88) -> 145
A92: Mean | B92: =AVERAGE(B2:B88) -> 67.773333333333326 | C92: =AVERAGE(C2:C88) -> 89.259259259259252 | D92: =AVERAGE(D2:D88) -> 77.282051282051285 | E92: =AVERAGE(E2:E88) -> 90.80 | F92: =AVERAGE(F2:F88) -> 77.71875 | G92: =AVERAGE(G2:G88) -> 92.655737704918039 | H92: =AVERAGE(H2:H88) -> 87.714285714285708 | I92: =AVERAGE(I2:I88) -> 92.80 | J92: =AVERAGE(J2:J88) -> 85.012345679012341 | K92: =AVERAGE(K2:K88) -> 65.00 | L92: =AVERAGE(L2:L88) -> 74.142857142857139 | M92: =AVERAGE(M2:M88) -> 80.723684210526315 | N92: =AVERAGE(N2:N88) -> 54.690140845070424 | O92: =AVERAGE(O2:O88) -> 80.00 | P92: =AVERAGE(P2:P88) -> 84.575000000000003
A93: Median | B93: =MEDIAN(B2:B88) -> 72.00 | C93: =MEDIAN(C2:C88) -> 90.00 | D93: =MEDIAN(D2:D88) -> 80.00 | E93: =MEDIAN(E2:E88) -> 92.00 | F93: =MEDIAN(F2:F88) -> 81.50 | G93: =MEDIAN(G2:G88) -> 95.00 | H93: =MEDIAN(H2:H88) -> 91.00 | I93: =MEDIAN(I2:I88) -> 96.50 | J93: =MEDIAN(J2:J88) -> 90.00 | K93: =MEDIAN(K2:K88) -> 65.00 | L93: =MEDIAN(L2:L88) -> 80.00 | M93: =MEDIAN(M2:M88) -> 80.50 | N93: =MEDIAN(N2:N88) -> 55.00 | O93: =MEDIAN(O2:O88) -> 80.00 | P93: =MEDIAN(P2:P88) -> 83.00
A94: Min | B94: =MIN(B2:B88) -> 6 | C94: =MIN(C2:C88) -> 64 | D94: =MIN(D2:D88) -> 25 | E94: =MIN(E2:E88) -> 73 | F94: =MIN(F2:F88) -> 30 | G94: =MIN(G2:G88) -> 76 | H94: =MIN(H2:H88) -> 60 | I94: =MIN(I2:I88) -> 36 | J94: =MIN(J2:J88) -> 32 | K94: =MIN(K2:K88) -> 15 | L94: =MIN(L2:L88) -> 0 | M94: =MIN(M2:M88) -> 45 | N94: =MIN(N2:N88) -> 15 | O94: =MIN(O2:O88) -> 53 | P94: =MIN(P2:P88) -> 18